{
  "run_id": "run_20251029_124518",
  "timestamp": "2025-10-29T12:45:18.788018",
  "model_id": "mock-llm",
  "total_prompts": 50,
  "results": [
    {
      "prompt_id": "P001",
      "category": "technical_query",
      "metrics": {
        "adequacy": 0.5,
        "factuality": 0.924,
        "latency_ms": 0,
        "cost_usd": 0.000312,
        "tokens_in": 9,
        "tokens_out": 19,
        "keywords_matched": [
          "hdf5",
          "append-only"
        ]
      }
    },
    {
      "prompt_id": "P002",
      "category": "technical_query",
      "metrics": {
        "adequacy": 0.25,
        "factuality": 0.959,
        "latency_ms": 0,
        "cost_usd": 0.000345,
        "tokens_in": 10,
        "tokens_out": 21,
        "keywords_matched": [
          "session"
        ]
      }
    },
    {
      "prompt_id": "P003",
      "category": "technical_query",
      "metrics": {
        "adequacy": 0.225,
        "factuality": 0.865,
        "latency_ms": 0,
        "cost_usd": 0.000291,
        "tokens_in": 7,
        "tokens_out": 18,
        "keywords_matched": [
          "verify"
        ]
      }
    },
    {
      "prompt_id": "P004",
      "category": "technical_query",
      "metrics": {
        "adequacy": 0.45,
        "factuality": 0.918,
        "latency_ms": 0,
        "cost_usd": 0.000291,
        "tokens_in": 7,
        "tokens_out": 18,
        "keywords_matched": [
          "export",
          "manifest"
        ]
      }
    },
    {
      "prompt_id": "P005",
      "category": "technical_query",
      "metrics": {
        "adequacy": 0.45,
        "factuality": 0.915,
        "latency_ms": 0,
        "cost_usd": 0.000273,
        "tokens_in": 6,
        "tokens_out": 17,
        "keywords_matched": [
          "mutation",
          "policy"
        ]
      }
    },
    {
      "prompt_id": "P006",
      "category": "workflow",
      "metrics": {
        "adequacy": 0.0,
        "factuality": 0.869,
        "latency_ms": 0,
        "cost_usd": 0.000327,
        "tokens_in": 9,
        "tokens_out": 20,
        "keywords_matched": []
      }
    },
    {
      "prompt_id": "P007",
      "category": "workflow",
      "metrics": {
        "adequacy": 0.25,
        "factuality": 0.857,
        "latency_ms": 0,
        "cost_usd": 0.000327,
        "tokens_in": 9,
        "tokens_out": 20,
        "keywords_matched": [
          "json"
        ]
      }
    },
    {
      "prompt_id": "P008",
      "category": "workflow",
      "metrics": {
        "adequacy": 0.0,
        "factuality": 0.88,
        "latency_ms": 0,
        "cost_usd": 0.000291,
        "tokens_in": 7,
        "tokens_out": 18,
        "keywords_matched": []
      }
    },
    {
      "prompt_id": "P009",
      "category": "workflow",
      "metrics": {
        "adequacy": 0.225,
        "factuality": 0.928,
        "latency_ms": 0,
        "cost_usd": 0.000312,
        "tokens_in": 9,
        "tokens_out": 19,
        "keywords_matched": [
          "search"
        ]
      }
    },
    {
      "prompt_id": "P010",
      "category": "workflow",
      "metrics": {
        "adequacy": 0.0,
        "factuality": 0.939,
        "latency_ms": 0,
        "cost_usd": 0.000291,
        "tokens_in": 7,
        "tokens_out": 18,
        "keywords_matched": []
      }
    },
    {
      "prompt_id": "P011",
      "category": "architecture",
      "metrics": {
        "adequacy": 0.2,
        "factuality": 0.888,
        "latency_ms": 0,
        "cost_usd": 0.000297,
        "tokens_in": 9,
        "tokens_out": 18,
        "keywords_matched": [
          "hexagonal"
        ]
      }
    },
    {
      "prompt_id": "P012",
      "category": "architecture",
      "metrics": {
        "adequacy": 0.225,
        "factuality": 0.865,
        "latency_ms": 0,
        "cost_usd": 0.000291,
        "tokens_in": 7,
        "tokens_out": 18,
        "keywords_matched": [
          "local-first"
        ]
      }
    },
    {
      "prompt_id": "P013",
      "category": "architecture",
      "metrics": {
        "adequacy": 0.0,
        "factuality": 0.917,
        "latency_ms": 0,
        "cost_usd": 0.000273,
        "tokens_in": 6,
        "tokens_out": 17,
        "keywords_matched": []
      }
    },
    {
      "prompt_id": "P014",
      "category": "architecture",
      "metrics": {
        "adequacy": 0.0,
        "factuality": 0.976,
        "latency_ms": 0,
        "cost_usd": 0.000273,
        "tokens_in": 6,
        "tokens_out": 17,
        "keywords_matched": []
      }
    },
    {
      "prompt_id": "P015",
      "category": "architecture",
      "metrics": {
        "adequacy": 0.225,
        "factuality": 0.904,
        "latency_ms": 0,
        "cost_usd": 0.000237,
        "tokens_in": 4,
        "tokens_out": 15,
        "keywords_matched": [
          "policy"
        ]
      }
    },
    {
      "prompt_id": "P016",
      "category": "philosophy",
      "metrics": {
        "adequacy": 0.0,
        "factuality": 0.951,
        "latency_ms": 0,
        "cost_usd": 0.000291,
        "tokens_in": 7,
        "tokens_out": 18,
        "keywords_matched": []
      }
    },
    {
      "prompt_id": "P017",
      "category": "philosophy",
      "metrics": {
        "adequacy": 0.0,
        "factuality": 0.989,
        "latency_ms": 0,
        "cost_usd": 0.000309,
        "tokens_in": 8,
        "tokens_out": 19,
        "keywords_matched": []
      }
    },
    {
      "prompt_id": "P018",
      "category": "philosophy",
      "metrics": {
        "adequacy": 0.0,
        "factuality": 0.896,
        "latency_ms": 0,
        "cost_usd": 0.000309,
        "tokens_in": 8,
        "tokens_out": 19,
        "keywords_matched": []
      }
    },
    {
      "prompt_id": "P019",
      "category": "philosophy",
      "metrics": {
        "adequacy": 0.0,
        "factuality": 0.894,
        "latency_ms": 0,
        "cost_usd": 0.000291,
        "tokens_in": 7,
        "tokens_out": 18,
        "keywords_matched": []
      }
    },
    {
      "prompt_id": "P020",
      "category": "philosophy",
      "metrics": {
        "adequacy": 0.0,
        "factuality": 0.984,
        "latency_ms": 0,
        "cost_usd": 0.000327,
        "tokens_in": 9,
        "tokens_out": 20,
        "keywords_matched": []
      }
    },
    {
      "prompt_id": "P021",
      "category": "troubleshooting",
      "metrics": {
        "adequacy": 0.225,
        "factuality": 0.909,
        "latency_ms": 0,
        "cost_usd": 0.000327,
        "tokens_in": 9,
        "tokens_out": 20,
        "keywords_matched": [
          "lock"
        ]
      }
    },
    {
      "prompt_id": "P022",
      "category": "troubleshooting",
      "metrics": {
        "adequacy": 0.0,
        "factuality": 0.9,
        "latency_ms": 0,
        "cost_usd": 0.000327,
        "tokens_in": 9,
        "tokens_out": 20,
        "keywords_matched": []
      }
    },
    {
      "prompt_id": "P023",
      "category": "troubleshooting",
      "metrics": {
        "adequacy": 0.2,
        "factuality": 0.874,
        "latency_ms": 0,
        "cost_usd": 0.000273,
        "tokens_in": 6,
        "tokens_out": 17,
        "keywords_matched": [
          "hash"
        ]
      }
    },
    {
      "prompt_id": "P024",
      "category": "troubleshooting",
      "metrics": {
        "adequacy": 0.0,
        "factuality": 0.92,
        "latency_ms": 0,
        "cost_usd": 0.000291,
        "tokens_in": 7,
        "tokens_out": 18,
        "keywords_matched": []
      }
    },
    {
      "prompt_id": "P025",
      "category": "troubleshooting",
      "metrics": {
        "adequacy": 0.0,
        "factuality": 0.862,
        "latency_ms": 0,
        "cost_usd": 0.000291,
        "tokens_in": 7,
        "tokens_out": 18,
        "keywords_matched": []
      }
    },
    {
      "prompt_id": "P026",
      "category": "best_practices",
      "metrics": {
        "adequacy": 0.0,
        "factuality": 0.995,
        "latency_ms": 0,
        "cost_usd": 0.000291,
        "tokens_in": 7,
        "tokens_out": 18,
        "keywords_matched": []
      }
    },
    {
      "prompt_id": "P027",
      "category": "best_practices",
      "metrics": {
        "adequacy": 0.25,
        "factuality": 0.863,
        "latency_ms": 0,
        "cost_usd": 0.000291,
        "tokens_in": 7,
        "tokens_out": 18,
        "keywords_matched": [
          "friday"
        ]
      }
    },
    {
      "prompt_id": "P028",
      "category": "best_practices",
      "metrics": {
        "adequacy": 0.45,
        "factuality": 0.885,
        "latency_ms": 0,
        "cost_usd": 0.000291,
        "tokens_in": 7,
        "tokens_out": 18,
        "keywords_matched": [
          "export",
          "backup"
        ]
      }
    },
    {
      "prompt_id": "P029",
      "category": "best_practices",
      "metrics": {
        "adequacy": 0.225,
        "factuality": 0.915,
        "latency_ms": 0,
        "cost_usd": 0.000309,
        "tokens_in": 8,
        "tokens_out": 19,
        "keywords_matched": [
          "tags"
        ]
      }
    },
    {
      "prompt_id": "P030",
      "category": "best_practices",
      "metrics": {
        "adequacy": 0.2,
        "factuality": 0.851,
        "latency_ms": 0,
        "cost_usd": 0.000309,
        "tokens_in": 8,
        "tokens_out": 19,
        "keywords_matched": [
          "routing"
        ]
      }
    },
    {
      "prompt_id": "P031",
      "category": "security",
      "metrics": {
        "adequacy": 0.2,
        "factuality": 0.926,
        "latency_ms": 0,
        "cost_usd": 0.000255,
        "tokens_in": 5,
        "tokens_out": 16,
        "keywords_matched": [
          "hipaa"
        ]
      }
    },
    {
      "prompt_id": "P032",
      "category": "security",
      "metrics": {
        "adequacy": 0.0,
        "factuality": 0.889,
        "latency_ms": 0,
        "cost_usd": 0.000291,
        "tokens_in": 7,
        "tokens_out": 18,